{
  "schema_version": "1.4.0",
  "artifact_type": "role_registry",
  "roles": [
    {
      "id": "p-solo",
      "tag": "maker",
      "gates": [
        "p-build"
      ],
      "write_scopes": [
        "src/",
        "scratch/"
      ],
      "diagnostic_capability": true,
      "invocation": {
        "prompt": "parent"
      }
    }
  ],
  "arms": [
    {
      "id": "P1",
      "roles": [
        "p-solo"
      ]
    }
  ]
}
